{
  "$schema": "../schema/native-toolchain-evidence.schema.json",
  "schemaId": "local-whisper-native-toolchain-evidence-v1",
  "profileId": "linux-x64-clang-18.1.3-asan-ubsan-v1",
  "profileInputDigest": "260732cb5df842e122ed824d885df1477faa9dc625d4f9eaa1881eb4a53f72b6",
  "inputs": {
    "sourceLockIds": [],
    "patchLockIds": [],
    "qualificationFixture": {
      "fixtureId": "local-whisper-sanitizer-proof-v1",
      "manifestSha256": "3bb36122211ef9f9f189d0fe670690c78335ba0da4df9bd3a7e5a18587c3a4e5"
    }
  },
  "toolIdentities": [
    {
      "id": "c-compiler",
      "path": "clang-18.1.3/usr/lib/llvm-18/bin/clang",
      "sha256": "8ef402d453d1ba4902e4ee0f0f847f6cfa01400c95aa43c24e97818b9c0e3f45",
      "versionOutputSha256": "930b91345db270c113e15f51ba32d6d9521ce3e389bf3efebe8b8c744e93d1e5"
    },
    {
      "id": "cxx-compiler",
      "path": "clang-18.1.3/usr/lib/llvm-18/bin/clang++",
      "sha256": "8ef402d453d1ba4902e4ee0f0f847f6cfa01400c95aa43c24e97818b9c0e3f45",
      "versionOutputSha256": "930b91345db270c113e15f51ba32d6d9521ce3e389bf3efebe8b8c744e93d1e5"
    },
    {
      "id": "linker",
      "path": "clang-18.1.3/usr/lib/llvm-18/bin/ld.lld",
      "sha256": "7ad9a0e8fe6d0e79b71172d731e33872c0274e49fceb7b516d774876d5a58ade",
      "versionOutputSha256": "437f2cfa55ea0d61f34fd9b318779c9229a7f2b3c44c9a403a753b940a571618"
    },
    {
      "id": "archiver",
      "path": "clang-18.1.3/usr/lib/llvm-18/bin/llvm-ar",
      "sha256": "eedd2efbdee80acf60e17e10adeddf31be0347226245f935be95efa3ae00ec79",
      "versionOutputSha256": "b4d7bedc0d026a83e54b1399b74f8e6a315a1b6fe8c4235acae5ad68780da1af"
    },
    {
      "id": "ranlib",
      "path": "clang-18.1.3/usr/lib/llvm-18/bin/llvm-ranlib",
      "sha256": "eedd2efbdee80acf60e17e10adeddf31be0347226245f935be95efa3ae00ec79",
      "versionOutputSha256": "b4d7bedc0d026a83e54b1399b74f8e6a315a1b6fe8c4235acae5ad68780da1af"
    },
    {
      "id": "cmake",
      "path": "cmake-3.31.8/bin/cmake",
      "sha256": "8df68e8be95c6e8f7c329b24f38fd209dc6f57f2f22433d0f81bd43a31a8744d",
      "versionOutputSha256": "3a89cbec6499862ef96a90e57d785ead4bcbb52d067dd18ffe26becf6b7fca29"
    },
    {
      "id": "ninja",
      "path": "ninja-1.12.1/ninja",
      "sha256": "cf10a35d13a384fed866bcd4989c7761e8556209d195cc6d2a7c0f11cc73804c",
      "versionOutputSha256": "b0e2efb26a08a9531ecc38f99575a8ac67e27d5da45e96f80ad8a1b2cec5a724"
    },
    {
      "id": "elf-inspector",
      "path": "/usr/bin/x86_64-linux-gnu-readelf",
      "sha256": "64c58e15274bbbb5153f31078e455e9e77ee5f51489e709bba5bb788ce9df2b0",
      "versionOutputSha256": "6c9ea96da96fdccf071fbe30e2d79a9e2e4ecb50d44dbd06b10b467d61468ebb"
    },
    {
      "id": "network-harness",
      "path": "/usr/bin/unshare",
      "sha256": "51bcc77ba5db162c80028f861f0a2770d728c1de80773816d863f28d7a817adb",
      "versionOutputSha256": "6b575db369f49f7896cde4988c96dfa0554a9ff20e8c1064490a433d9db6cee2"
    },
    {
      "id": "network-probe-runtime",
      "path": "/usr/bin/python3.12",
      "sha256": "1643dacd9feaedc58f3cc581e4d22577dfe25c09b10282936186ccf0f2e61118",
      "versionOutputSha256": "d083976b6846dd2f34e37889386613f8aad839a27807f610a513e90b20f3ff52"
    }
  ],
  "runtimeIdentities": [
    {
      "id": "clang-asan-18.1.3",
      "path": "clang-18.1.3/usr/lib/llvm-18/lib/clang/18/lib/linux/libclang_rt.asan-x86_64.so",
      "sha256": "221c945e3742ba52aa7de6924f7008fc51bb8e84068404ea62924ca7f05b9335"
    },
    {
      "id": "clang-ubsan-18.1.3",
      "path": "clang-18.1.3/usr/lib/llvm-18/lib/clang/18/lib/linux/libclang_rt.ubsan_standalone-x86_64.so",
      "sha256": "c02e56cac9f8fc6886db10d662e2ff7b007525585d3f984323cda31c8432b9da"
    },
    {
      "id": "libstdcxx-gcc-13",
      "path": "/usr/lib/x86_64-linux-gnu/libstdc++.so.6.0.33",
      "sha256": "1fd75fe70354a416d75aef22bcae68c47bd25d20e2d0568c30b1a9838cf62f11"
    },
    {
      "id": "libgcc-s-gcc-13",
      "path": "/usr/lib/x86_64-linux-gnu/libgcc_s.so.1",
      "sha256": "d93224d2b0dab4247598be683adca02f5cf00586f99c187579cd7e92058fb7cb"
    },
    {
      "id": "glibc-2.39",
      "path": "/usr/lib/x86_64-linux-gnu/libc.so.6",
      "sha256": "8db37cf3f2169f59a0f07ef1fea308c35656668c64c8ff294e1860f4121eb161"
    },
    {
      "id": "libm-glibc-2.39",
      "path": "/usr/lib/x86_64-linux-gnu/libm.so.6",
      "sha256": "e9c4b28d340e415b8137480ec442662f981e1399386c5931dae0e886e3639e91"
    },
    {
      "id": "ld-linux-glibc-2.39",
      "path": "/usr/lib/x86_64-linux-gnu/ld-linux-x86-64.so.2",
      "sha256": "cd4df4f3c7b83673d61189bf2eaebd33ca4f2853ab9772b8a25e025ef99b1e81"
    }
  ],
  "licenseIdentities": [
    {
      "id": "llvm-apache-2-exception",
      "path": "licenses/llvm-apache-2-exception.LICENSE",
      "sha256": "837f5d6ac67c8f7a5f43bf675a0f8afc1564600ebdc6f350411bc5dd790c2eda"
    },
    {
      "id": "cmake-bsd-3.31.8",
      "path": "licenses/cmake-bsd-3.31.8.LICENSE",
      "sha256": "0676e30827684487aa0ea8f72f01e9460a6320fa34a2888df0ad1dd3e8a06eb8"
    },
    {
      "id": "ninja-apache-2.0-1.12.1",
      "path": "licenses/ninja-apache-2.0-1.12.1.LICENSE",
      "sha256": "eb7e9ab9690124c5c9f42bdc81383d886a3dede26345b6ed15bbad7caf81f7ea"
    }
  ],
  "configuredCacheSha256": "0e834cf298dbc3220001e3012485acf1b322bf01adaf63df87abe8d39621d9ff",
  "effectiveCacheSha256": "a2d32a07803ed9e8cc689051fd60b1f0f2b0bca7f1ed33e33c6fbdfd6ac3eaa4",
  "generatedBuildGraphSha256": "0022bf1fcd3b7e287ab19f83db6bfa29f1bc8003127adf98e117fea34cf4bd2e",
  "generatedTargets": [
    "local-whisper-sanitizer-clean",
    "local-whisper-sanitizer-asan-trigger",
    "local-whisper-sanitizer-ubsan-trigger"
  ],
  "executions": [
    {
      "target": "local-whisper-sanitizer-clean",
      "purpose": "clean",
      "exitStatus": 0,
      "signal": null,
      "stdoutSha256": "6e1336720b641d870fc85b7795c786f9e0b593ce954da20a5341842c45689df5",
      "stderrSha256": "e3b0c44298fc1c149afbf4c8996fb92427ae41e4649b934ca495991b7852b855",
      "requiredMarkers": ["LOCAL_WHISPER_SANITIZER_CLEAN_OK"],
      "observedMarkers": ["LOCAL_WHISPER_SANITIZER_CLEAN_OK"],
      "networkNamespace": "user-network-isolated"
    },
    {
      "target": "local-whisper-sanitizer-asan-trigger",
      "purpose": "asan-trigger",
      "exitStatus": 1,
      "signal": null,
      "stdoutSha256": "e3b0c44298fc1c149afbf4c8996fb92427ae41e4649b934ca495991b7852b855",
      "stderrSha256": "491eafd9520a8c914aa07dca4b526c05e30c7ad3a35e351970ed1dbfd0704226",
      "requiredMarkers": ["AddressSanitizer", "heap-use-after-free"],
      "observedMarkers": ["AddressSanitizer", "heap-use-after-free"],
      "networkNamespace": "user-network-isolated"
    },
    {
      "target": "local-whisper-sanitizer-ubsan-trigger",
      "purpose": "ubsan-trigger",
      "exitStatus": 1,
      "signal": null,
      "stdoutSha256": "e3b0c44298fc1c149afbf4c8996fb92427ae41e4649b934ca495991b7852b855",
      "stderrSha256": "5c350f3d8223c10d23fb7169896e0931fbc37a1b4cb268b8042e47b04fab63eb",
      "requiredMarkers": ["runtime error:", "signed integer overflow"],
      "observedMarkers": ["runtime error:", "signed integer overflow"],
      "networkNamespace": "user-network-isolated"
    }
  ],
  "stagedFiles": [
    {
      "id": "sanitizer-clean",
      "relativePath": "bin/local-whisper-sanitizer-clean",
      "sha256": "6a5c3dbd49965e6a9c1d386a016f31279e0756b68e87427c36f5c6e6bcc4113e",
      "mode": "100755"
    },
    {
      "id": "sanitizer-asan-trigger",
      "relativePath": "bin/local-whisper-sanitizer-asan-trigger",
      "sha256": "ce6e0c7c8574c5bf3c1b2b2f97e25f1ffd908464fa8a17a7dc1de2c9f11a5873",
      "mode": "100755"
    },
    {
      "id": "sanitizer-ubsan-trigger",
      "relativePath": "bin/local-whisper-sanitizer-ubsan-trigger",
      "sha256": "6b3ce734174ab064d675164d32ddcbfd6dce6ed294d571abdd9ab41e310532cd",
      "mode": "100755"
    },
    {
      "id": "clang-asan-18.1.3",
      "relativePath": "lib/libclang_rt.asan-x86_64.so",
      "sha256": "221c945e3742ba52aa7de6924f7008fc51bb8e84068404ea62924ca7f05b9335",
      "mode": "100644"
    },
    {
      "id": "clang-ubsan-18.1.3",
      "relativePath": "lib/libclang_rt.ubsan_standalone-x86_64.so",
      "sha256": "c02e56cac9f8fc6886db10d662e2ff7b007525585d3f984323cda31c8432b9da",
      "mode": "100644"
    },
    {
      "id": "llvm-apache-2-exception",
      "relativePath": "licenses/llvm-apache-2-exception.LICENSE",
      "sha256": "837f5d6ac67c8f7a5f43bf675a0f8afc1564600ebdc6f350411bc5dd790c2eda",
      "mode": "100644"
    },
    {
      "id": "cmake-bsd-3.31.8",
      "relativePath": "licenses/cmake-bsd-3.31.8.LICENSE",
      "sha256": "0676e30827684487aa0ea8f72f01e9460a6320fa34a2888df0ad1dd3e8a06eb8",
      "mode": "100644"
    },
    {
      "id": "ninja-apache-2.0-1.12.1",
      "relativePath": "licenses/ninja-apache-2.0-1.12.1.LICENSE",
      "sha256": "eb7e9ab9690124c5c9f42bdc81383d886a3dede26345b6ed15bbad7caf81f7ea",
      "mode": "100644"
    }
  ],
  "dependencyClosure": {
    "inspector": {
      "path": "/usr/bin/x86_64-linux-gnu-readelf",
      "sha256": "64c58e15274bbbb5153f31078e455e9e77ee5f51489e709bba5bb788ce9df2b0"
    },
    "records": [
      {
        "fileId": "sanitizer-clean",
        "relativePath": "bin/local-whisper-sanitizer-clean",
        "sha256": "6a5c3dbd49965e6a9c1d386a016f31279e0756b68e87427c36f5c6e6bcc4113e",
        "needed": [
          {
            "soname": "libclang_rt.asan-x86_64.so",
            "resolutionKind": "staged",
            "resolvedId": "clang-asan-18.1.3",
            "sha256": "221c945e3742ba52aa7de6924f7008fc51bb8e84068404ea62924ca7f05b9335"
          },
          {
            "soname": "libstdc++.so.6",
            "resolutionKind": "reviewed-system",
            "resolvedId": "libstdcxx-gcc-13",
            "sha256": "1fd75fe70354a416d75aef22bcae68c47bd25d20e2d0568c30b1a9838cf62f11"
          },
          {
            "soname": "libm.so.6",